<!ELEMENT tareas (tarea+)>
<!ELEMENT tarea (titulo, descripcion, fecha, categoria, prioridad, terminada)>
<!ATTLIST tarea id CDATA #REQUIRED>

<!ELEMENT titulo (#PCDATA)>
<!ELEMENT descripcion (#PCDATA)>
<!ELEMENT fecha (#PCDATA)>

<!ELEMENT categoria (nombre, color)>
<!ELEMENT nombre (#PCDATA)>
<!ELEMENT color (#PCDATA)>

<!ELEMENT prioridad (#PCDATA)>
<!ELEMENT terminada (#PCDATA)>